{"vertices":21,"edges":[[0,1],[0,6],[0,9],[0,15],[1,4],[1,6],[1,18],[2,3],[2,6],[2,8],[2,13],[3,5],[3,6],[3,19],[4,5],[4,7],[4,8],[4,14],[5,7],[5,9],[5,12],[6,10],[6,17],[7,11],[7,17],[8,13],[8,14],[8,16],[9,12],[9,15],[9,16],[10,12],[10,14],[10,17],[11,13],[11,15],[11,17],[12,13],[12,18],[13,18],[14,15],[14,19],[15,19],[16,17],[16,20],[17,20],[18,19],[18,20],[19,20]],"claimed_score":"22/1","claimed_improvement":"1/1"}
